{
  "schema_version": 1,
  "workspace_root": ".",
  "generated_at": "1786055172s-unix",
  "items": [
    {
      "crate_name": "remotelink-auth",
      "path": "packages/auth/src/challenge.rs",
      "item": "AuthChallenge",
      "kind": "struct",
      "visibility": "pub",
      "line": 184
    },
    {
      "crate_name": "remotelink-auth",
      "path": "packages/auth/src/challenge.rs",
      "item": "AuthChallenge::issue",
      "kind": "fn",
      "visibility": "pub",
      "line": 191
    },
    {
      "crate_name": "remotelink-auth",
      "path": "packages/auth/src/challenge.rs",
      "item": "AuthChallenge::verify_response",
      "kind": "fn",
      "visibility": "pub",
      "line": 198
    },
    {
      "crate_name": "remotelink-auth",
      "path": "packages/auth/src/challenge.rs",
      "item": "CHALLENGE_MAC_LEN",
      "kind": "const",
      "visibility": "pub",
      "line": 22
    },
    {
      "crate_name": "remotelink-auth",
      "path": "packages/auth/src/challenge.rs",
      "item": "CHALLENGE_NONCE_LEN",
      "kind": "const",
      "visibility": "pub",
      "line": 19
    },
    {
      "crate_name": "remotelink-auth",
      "path": "packages/auth/src/challenge.rs",
      "item": "ChallengeNonce",
      "kind": "struct",
      "visibility": "pub",
      "line": 73
    },
    {
      "crate_name": "remotelink-auth",
      "path": "packages/auth/src/challenge.rs",
      "item": "ChallengeNonce::as_bytes",
      "kind": "fn",
      "visibility": "pub",
      "line": 96
    },
    {
      "crate_name": "remotelink-auth",
      "path": "packages/auth/src/challenge.rs",
      "item": "ChallengeNonce::from_bytes",
      "kind": "fn",
      "visibility": "pub",
      "line": 87
    },
    {
      "crate_name": "remotelink-auth",
      "path": "packages/auth/src/challenge.rs",
      "item": "ChallengeNonce::generate",
      "kind": "fn",
      "visibility": "pub",
      "line": 80
    },
    {
      "crate_name": "remotelink-auth",
      "path": "packages/auth/src/challenge.rs",
      "item": "ChallengeTranscript",
      "kind": "struct",
      "visibility": "pub",
      "line": 111
    },
    {
      "crate_name": "remotelink-auth",
      "path": "packages/auth/src/challenge.rs",
      "item": "ChallengeTranscript::encode",
      "kind": "fn",
      "visibility": "pub",
      "line": 127
    },
    {
      "crate_name": "remotelink-auth",
      "path": "packages/auth/src/challenge.rs",
      "item": "HOST_SECRET_MIN_LEN",
      "kind": "const",
      "visibility": "pub",
      "line": 26
    },
    {
      "crate_name": "remotelink-auth",
      "path": "packages/auth/src/challenge.rs",
      "item": "HostSecret",
      "kind": "struct",
      "visibility": "pub",
      "line": 33
    },
    {
      "crate_name": "remotelink-auth",
      "path": "packages/auth/src/challenge.rs",
      "item": "HostSecret::as_bytes",
      "kind": "fn",
      "visibility": "pub",
      "line": 60
    },
    {
      "crate_name": "remotelink-auth",
      "path": "packages/auth/src/challenge.rs",
      "item": "HostSecret::generate",
      "kind": "fn",
      "visibility": "pub",
      "line": 53
    },
    {
      "crate_name": "remotelink-auth",
      "path": "packages/auth/src/challenge.rs",
      "item": "HostSecret::try_new",
      "kind": "fn",
      "visibility": "pub",
      "line": 41
    },
    {
      "crate_name": "remotelink-auth",
      "path": "packages/auth/src/challenge.rs",
      "item": "PakeVerifierStub",
      "kind": "struct",
      "visibility": "pub",
      "line": 240
    },
    {
      "crate_name": "remotelink-auth",
      "path": "packages/auth/src/challenge.rs",
      "item": "PakeVerifierStub::new",
      "kind": "fn",
      "visibility": "pub",
      "line": 247
    },
    {
      "crate_name": "remotelink-auth",
      "path": "packages/auth/src/challenge.rs",
      "item": "PakeVerifierStub::start_handshake",
      "kind": "fn",
      "visibility": "pub",
      "line": 252
    },
    {
      "crate_name": "remotelink-auth",
      "path": "packages/auth/src/challenge.rs",
      "item": "compute_challenge_mac",
      "kind": "fn",
      "visibility": "pub",
      "line": 152
    },
    {
      "crate_name": "remotelink-auth",
      "path": "packages/auth/src/challenge.rs",
      "item": "pake",
      "kind": "mod",
      "visibility": "pub",
      "line": 237
    },
    {
      "crate_name": "remotelink-auth",
      "path": "packages/auth/src/challenge.rs",
      "item": "respond_to_challenge",
      "kind": "fn",
      "visibility": "pub",
      "line": 217
    },
    {
      "crate_name": "remotelink-auth",
      "path": "packages/auth/src/challenge.rs",
      "item": "verify_challenge_mac",
      "kind": "fn",
      "visibility": "pub",
      "line": 166
    },
    {
      "crate_name": "remotelink-auth",
      "path": "packages/auth/src/device_id.rs",
      "item": "DEVICE_ID_BODY_DIGITS",
      "kind": "const",
      "visibility": "pub",
      "line": 16
    },
    {
      "crate_name": "remotelink-auth",
      "path": "packages/auth/src/device_id.rs",
      "item": "DEVICE_ID_TOTAL_DIGITS",
      "kind": "const",
      "visibility": "pub",
      "line": 19
    },
    {
      "crate_name": "remotelink-auth",
      "path": "packages/auth/src/device_id.rs",
      "item": "DevicePublicId",
      "kind": "struct",
      "visibility": "pub",
      "line": 23
    },
    {
      "crate_name": "remotelink-auth",
      "path": "packages/auth/src/device_id.rs",
      "item": "DevicePublicId::as_str",
      "kind": "fn",
      "visibility": "pub",
      "line": 82
    },
    {
      "crate_name": "remotelink-auth",
      "path": "packages/auth/src/device_id.rs",
      "item": "DevicePublicId::display_grouped",
      "kind": "fn",
      "visibility": "pub",
      "line": 92
    },
    {
      "crate_name": "remotelink-auth",
      "path": "packages/auth/src/device_id.rs",
      "item": "DevicePublicId::generate",
      "kind": "fn",
      "visibility": "pub",
      "line": 30
    },
    {
      "crate_name": "remotelink-auth",
      "path": "packages/auth/src/device_id.rs",
      "item": "DevicePublicId::generate_with_rng",
      "kind": "fn",
      "visibility": "pub",
      "line": 35
    },
    {
      "crate_name": "remotelink-auth",
      "path": "packages/auth/src/device_id.rs",
      "item": "DevicePublicId::into_string",
      "kind": "fn",
      "visibility": "pub",
      "line": 87
    },
    {
      "crate_name": "remotelink-auth",
      "path": "packages/auth/src/device_id.rs",
      "item": "DevicePublicId::is_valid",
      "kind": "fn",
      "visibility": "pub",
      "line": 77
    },
    {
      "crate_name": "remotelink-auth",
      "path": "packages/auth/src/device_id.rs",
      "item": "DevicePublicId::parse",
      "kind": "fn",
      "visibility": "pub",
      "line": 53
    },
    {
      "crate_name": "remotelink-auth",
      "path": "packages/auth/src/device_id.rs",
      "item": "luhn_check_digit",
      "kind": "fn",
      "visibility": "pub",
      "line": 115
    },
    {
      "crate_name": "remotelink-auth",
      "path": "packages/auth/src/device_id.rs",
      "item": "validate_luhn",
      "kind": "fn",
      "visibility": "pub",
      "line": 144
    },
    {
      "crate_name": "remotelink-auth",
      "path": "packages/auth/src/error.rs",
      "item": "AuthError",
      "kind": "enum",
      "visibility": "pub",
      "line": 7
    },
    {
      "crate_name": "remotelink-auth",
      "path": "packages/auth/src/error.rs",
      "item": "Result",
      "kind": "type",
      "visibility": "pub",
      "line": 38
    },
    {
      "crate_name": "remotelink-auth",
      "path": "packages/auth/src/fingerprint.rs",
      "item": "encode_binding_message",
      "kind": "fn",
      "visibility": "pub",
      "line": 18
    },
    {
      "crate_name": "remotelink-auth",
      "path": "packages/auth/src/fingerprint.rs",
      "item": "generate_device_keypair",
      "kind": "fn",
      "visibility": "pub",
      "line": 11
    },
    {
      "crate_name": "remotelink-auth",
      "path": "packages/auth/src/fingerprint.rs",
      "item": "sign_fingerprint_binding",
      "kind": "fn",
      "visibility": "pub",
      "line": 31
    },
    {
      "crate_name": "remotelink-auth",
      "path": "packages/auth/src/fingerprint.rs",
      "item": "signing_key_from_bytes",
      "kind": "fn",
      "visibility": "pub",
      "line": 67
    },
    {
      "crate_name": "remotelink-auth",
      "path": "packages/auth/src/fingerprint.rs",
      "item": "verify_fingerprint_binding",
      "kind": "fn",
      "visibility": "pub",
      "line": 42
    },
    {
      "crate_name": "remotelink-auth",
      "path": "packages/auth/src/fingerprint.rs",
      "item": "verifying_key_from_bytes",
      "kind": "fn",
      "visibility": "pub",
      "line": 59
    },
    {
      "crate_name": "remotelink-auth",
      "path": "packages/auth/src/lib.rs",
      "item": "VERSION",
      "kind": "const",
      "visibility": "pub",
      "line": 44
    },
    {
      "crate_name": "remotelink-auth",
      "path": "packages/auth/src/lib.rs",
      "item": "challenge",
      "kind": "mod",
      "visibility": "pub",
      "line": 16
    },
    {
      "crate_name": "remotelink-auth",
      "path": "packages/auth/src/lib.rs",
      "item": "challenge::AuthChallenge",
      "kind": "use",
      "visibility": "pub",
      "line": 23
    },
    {
      "crate_name": "remotelink-auth",
      "path": "packages/auth/src/lib.rs",
      "item": "challenge::CHALLENGE_MAC_LEN",
      "kind": "use",
      "visibility": "pub",
      "line": 23
    },
    {
      "crate_name": "remotelink-auth",
      "path": "packages/auth/src/lib.rs",
      "item": "challenge::CHALLENGE_NONCE_LEN",
      "kind": "use",
      "visibility": "pub",
      "line": 23
    },
    {
      "crate_name": "remotelink-auth",
      "path": "packages/auth/src/lib.rs",
      "item": "challenge::ChallengeNonce",